{
  "$schema": "https://json-schema.org/draft/2020-12/schema",
  "$id": "https://github.com/mbta/schemas/blob/main/schemas/com.mbta.ctd.glides.editors_changed.v1.json",
  "description": "Editors Changed",
  "type": "object",
  "properties": {
    "type": { "const": "com.mbta.ctd.glides.editors_changed.v1" },
    "specversion": { "const": "1.0" },
    "source": { "$ref": "glides-events.json#/properties/source" },
    "id": { "$ref": "glides-events.json#/properties/id" },
    "time": { "$ref": "glides-events.json#/$defs/timestamp" },
    "data": {
      "type": "object",
      "properties": {
        "metadata": { "$ref": "glides-events.json#/$defs/metadata" },
        "changes": {
          "type": "array",
          "items": { "$ref": "#/$defs/editor_change" }
        }
      },
      "required": ["metadata", "changes"]
    }
  },
  "required": ["type", "specversion", "source", "id", "time", "data"],
  "$defs": {
    "editor_change": {
      "type": "object",
      "properties": {
        "type": {
          "type": "string",
          "oneOf": [{ "const": "start" }, { "const": "stop" }]
        },
        "location": { "$ref": "glides-events.json#/$defs/location" },
        "editor": { "$ref": "glides-events.json#/$defs/glides_user" }
      },
      "required": ["type", "location", "editor"]
    }
  }
}
